kor,eng
시작,BOS
종료,EOS
(고춧가루제외)갈치조림,(chilli powder-free) braised cutlassfish
(고춧가루제외)상추겉절이,(chilli powder-free) braised lettuce
(고춧가루제외)고등어조림,(chilli powder-free) braised mackerel
(고춧가루제외)도토리묵무침,(chilli powder-free) seasoned salad with acorn jelly
(고춧가루제외)부추사과무침,(chilli powder-free) seasoned salad with chive and apple
(고춧가루제외)오이무침,(chilli powder-free) seasoned salad with cucumber
(고춧가루제외)노각무침,(chilli powder-free) seasoned salad with overripe cucumber
(수제)떡갈비구이,(homestyle) roasted pork roll with rice cake
(저염·저당)메추리알케첩조림,(low salt and sugar) braised quail eggs in ketchup
(저염·저당)메추리알장조림,(low salt and sugar) braised quail eggs in soy sauce
(저염)소고기호두조림,(low sodium) braised beef and walnut
(저염·저당)돼지고기메추리알조림,"(low sodium, low sugar) braised pork and quail egg"
(저염·저당)소고기장조림,"(low sodium, low sugar) soy sauce-braised beef"
(저염·저당)우엉조림,(low salt and sugar) braised burdock slices
(저염·저당)찜닭,(low salt and sugar) steamed chicken
(저염·저당)돼지갈비찜,(low salt and sugar) steamed pork rib
(저염)닭가슴살단호박조림,(low-salt) braised chicken and sweet pumpkin
(저염)닭가슴살데리야끼조림,(low-salt) braised chicken in teriyaki sauce
(저염)갈치조림,(low-salt) braised cutlassfish
(저염)달걀장조림,(low-salt) braised eggs in soy sauce
(저염)연근조림,(low-salt) braised lotus root
(저염)감자조림,(low-salt) braised potato
(저염)닭곰탕,(low-salt) chicken bone soup
(저염)닭가슴살피망볶음,(low-salt) stir-fried chicken and paprika
(저당)닭갈비,(low-sugar) stir-fried chicken
(소고기제외)당면양배추국,(no beef) glass noodles cabbage soup
(가공)만두튀김,(processed) deep-fried mandu (dumpling)
묵국,Acorn jelly soup
온도토리묵국,Acorn jelly soup(hot)
알리오올리오스파게티,Aglio e olio spaghetti
멸치주먹밥,Anchovy rice ball
멸치파래주먹밥,Anchovy sea lettuce rice ball
멸치장국,Anchovy soy paste soup
사과참외샐러드,Apple and korean melon salad
사과연근샐러드,Apple and lotus root salad
사과오렌지샐러드(요거트드레싱),Apple orange salad (yoghurt dressing)
사과샐러드,Apple salad
사과샐러드(발사믹드레싱),Apple salad (balsamic vinegar dressing)
사과샐러드(마요네즈),Apple salad (mayonnaise)
모듬어묵국,Assorted fried fish paste soup
모듬어묵탕,Assorted fried fish cake soup
모듬어묵장국,Assorted fried fish paste soy paste soup
모듬과일샐러드,Assorted fruit salad
모둠쌈,Assorted lettuce-wraps
모듬버섯탕수,Assorted mushroom dumpling
모듬버섯국,Assorted mushroom soup
모듬버섯된장국,Assorted mushroom soy paste soup
모듬버섯찌개,Assorted mushroom stew
잔멸치주먹밥,Baby anchovy rice ball
베이컨치즈스파게티,Bacon cheese spaghetti
베이컨크림떡볶이,Bacon cream tteokbokki (stir-fried rice cake)
베이컨주먹밥,Bacon rice ball
베이컨채소말이,Bacon roll with vegetables
도라지나물(간장),Balloon flower seasoned with soy sauce
바나나사과키위샐러드,Banana apple kiwi salad
잔치국수,Banquet noodles
소불고기,Barbequed beef
청경채불고기,Barbequed beef and bokchoy
우엉불고기,Barbequed beef and burdock
오징어불고기,Barbequed beef and cuttlefish
조랭이떡소불고기,Barbequed beef and mini-ball rice cake
고추장불고기,Barbequed beef in red chilli paste
불고기주먹밥,Barbequed beef rice ball
유부불고기덮밥,Barbequed beef rice bowl with fried tofu
미나리불고기덮밥,Barbequed beef rice bowl with water celery
닭살버섯불고기,Barbequed chicken and mushroom
오리불고기,Barbequed duck
돼지불고기,Barbequed pork
콩나물돼지불고기,Barbequed pork and bean sprout
부추돼지불고기,Barbequed pork and chive
파돼지불고기,Barbequed pork and spring onion
오삼불고기,Barbequed pork belly and cuttlefish
안매운오삼불고기,Barbequed pork belly and cuttlefish (mild flavor)
바베큐폭찹,Barbequed pork chops
간장돼지불고기,Barbequed pork in soy sauce
돼지간장불고기,bulgogi(pork)
돼지불고기덮밥,Barbequed pork over rice
열무보리비빔밥,Barely bibimbap with summer radish
콩가루무채국,Bean powder daikon soup
콩가루시래기국,Bean powder dried radish leaves soup
콩가루쑥국,Bean powder mugwort  soup
콩가루배추국,Bean powder napa cabbage soup
콩가루냉이된장국,Bean powder shepherd's purse soy paste soup
콩가루시금치국,Bean powder spinach  soup
콩가루봄동국,Bean powder spring cabbage soup
콩가루열무된장국,Bean powder summer radish soy paste soup
콩나물냉채,Bean sprout and mung bean jelly salad
콩나물미나리냉채,Bean sprout and winter celery salad
콩나물육개장,Bean sprout beef stew
콩나물무국,Bean sprout daikon soup
콩나물북어국,Bean sprout dried pollack soup
콩나물어묵국,Bean sprout fried fish paste soup
콩나물어묵탕,Bean sprout fried fish cake soup
콩나물국,Bean sprout soup
콩나물맑은국,Bean sprout soup(clear)
콩나물된장국,Bean sprout soy paste soup
콩나물쫄면,Bean sprout spicy chewy noodles
소고기가지덮밥,Beef and aubergine over rice
소고기콩나물국,Beef and bean sprout soup
소고기양배추덮밥,Beef and cabbage over rice
소고기팽이버섯국,Beef and enoki mushroom soup
소고기떡국,Beef and rice cake soup
소고기두부탕국,Beef and tofu soup
소고기비빔밥,Beef bibimbap
곰국,Beef bone soup
설렁탕,Beef bone soup(Beef edible offal)
양지곰국,Beef bone soup(plate)
사골파국,Beef bone-broth green onion soup
차돌버섯찌개,Beef brisket mushroom stew
차돌순두부백탕,Beef brisket unpressed tofu soup
차돌박이된장국,Beef brisket soy paste soup
차돌박이된장찌개,Beef brisket soy paste stew
차돌얼갈이국,Beef brisket winter cabbage soup
소불고기(등심),Beef bulgogi (sirloin)
소불고기(안심),Beef bulgogi (tenderloin)
소불고기덮밥,Beef bulgogi over rice
소불고기덮밥(안심),Beef bulgogi over rice (tenderloin)
소고기가지불고기,Beef bulgogi with aubergine
달래소불고기,Beef bulgogi with wild korean-leeks
소고기양배추국,Beef cabbage soup
소고기오이볶음밥,Beef cucumber fried rice
소고기볶음밥,Beef fried rice
소고기숙주국,Beef green bean sprout soup
소고기하이라이스,Beef hashed rice
소고기잡채,Beef japchae
소고기잡채덮밥,Beef japchae over rice
소고기부추볶음밥,Beef korean-leeks fried rice
소고기부추국,Beef korean-leeks soup
소고기상추비빔밥,Beef lettuce bibimbap
소고기버섯들깨국,Beef mushroom perilla seed soup
소고기버섯국,Beef mushroom soup
소고기버섯찌개,Beef mushroom stew
소고기배추국,Beef napa cabbage soup
소고기오므라이스,Beef omelet rice
소고기양파국,Beef onion soup
소고기전,Beef pancake
소고기깻잎국,Beef perilla leaf soup
소고기파인애플볶음밥,Beef pineapple fried rice
소고기감자국,Beef potato soup
소고기무국,Beef radish soup
소고기김주먹밥,Beef rice ball with seaweed flakes
소고기주먹밥,Beef rice balls
소고기쌀국수,Beef rice noodles
소고기순두부찌개,Beef unpressed tofu stew
소고기국,Beef soup
소고기탕국,Beef soup(based soy sauce)
소고기우거지국,Beef soup with boiled napa cabbage
소고기당면국,Beef soup with glass noodles
소고기비빔국수,Beef spicy noodles
소고기봄동국,Beef spring cabbage soup
맑은육개장,Beef stew(clear)
육개장,Beef stew
소고기짜장볶음,Beef stir-fried with black bean sauce
소고기카레볶음,Beef stir-fried with curry
소고기케첩볶음,Beef stir-fried with ketchup
소고기굴소스덮밥,Beef stir-fried with oyster sauce over rice
고추장소고기볶음,Beef stir-fried with red chili-pepper paste
소고기채소볶음밥,Beef vegetable fried rice
소고기얼갈이국,Beef winter cabbage soup
비트무초절임,Beet and daikon in vinegar marinade
비트무생채,Beet and daikon salad
도라지강정,Bellflower root nuggets
장조림버터비빔밥,Bibimbap with butter and braised beef in soy sauce
나물비빔밥,Bibimbap with herbs
청포묵비빔밥,Bibimbap with mung bean jelly
게살비빔밥,Bibimbap with soft crab
열무보리간장비빔밥,Bibimbap with soy-based barley rice and summer radish
봄나물비빔밥,Bibimbap with spring herbs
열무비빔밥,Bibimbap with summer radish
삼색나물비빔밥,Bibimbap with three-color herbs
참치비빔밥,Bibimbap with tuna
참치새싹비빔밥,Bibimbap with tuna and sprouts
참치채소비빔밥,Bibimbap with tuna and vagetable
채소비빔밥,Bibimbap with vegetables
겨울나물비빔밥,Bibimbap with winter herbs
왕만두국,Big dumpling soup
짜장면,Black soy noodles
짜장라이스,Black soy rice
짜장덮밥,Black soy rice bowl
고구마짜장밥,Black soy rice with sweet potato
호박짜장밥,Black soy rice with zucchini
짜장떡볶이,Black soy tteokbokki (stir-fried rice cake)
블루베리고구마샐러드,Blueberry sweet potato salad
돼지고기편육,Boiled and cooled pork slices
브로콜리숙채,Boiled broccoli
삶은달걀,Boiled egg
돼지수육,Boiled pork
돼지고기수육+쌈장,Boiled pork + ssamjang (soybean paste + red chili-pepper paste)
돼지고기보쌈,Boiled pork with nappa cabbage wraps
청경채맑은국,Bokchoy soup
청경채된장국,Bokchoy soy paste soup
뼈없는닭갈비,Boneless chicken steak with sauce
고사리나물,Bracken
명태조림,Braised alaska pollock
아몬드멸치조림,Braised almond and anchovy
건새우아몬드조림,Braised almond and dried shrimp
멸치조림,Braised anchovy
멸치아몬드조림,Braised anchovy and almond
멸치마늘조림,Braised anchovy and garlic stem
단배추멸치조림,Braised anchovy and sweet napa cabbage
멸치호두조림,Braised anchovy and walnut
임연수조림,Braised atka mackerel
임연수양념조림,Braised atka mackerel in soy sauce
임연수엿장조림,Braised atka mackerel in sweet soy sauce
임연수데리야끼조림,Braised atka mackerel in teriyaki sauce
임연수유자소스조림,Braised atka mackerel in yuzu sauce
아몬드잔멸치조림,Braised baby anchovy and almond
콩자반,beans cooked in soy sauce
콩조림,Braised beans
소고기브로콜리조림,Braised beef and broccoli
소고기우엉조림,Braised beef and burdock
소고기양배추조림,Braised beef and cabbage
소고기곤약조림,Braised beef and devil's tongue jelly
소고기당면조림,Braised beef and glass noodles
감자소고기조림,Braised potato and beef 
소고기감자조림,Braised beef(siroin)and potato
소고기메란조림,Braised beef and quail eggs
소고기떡조림,Braised beef and rice cake
고구마소고기조림,Braised beef and sweet potato
소고기단호박조림,Braised beef and sweet pumpkin
소고기단호박찜,Steamed beef and sweet pumpkin in soy sauce
소고기토마토조림,Braised beef and tomato
소고기채소조림,Braised beef and vegetables
소고기호두조림,Braised beef and walnut
애호박소고기찜,Braised beef and zucchini
소고기장똑똑이,Braised beef chops
모듬장조림,Braised pork and quail egg in soy sauce
소고기모듬장조림,Braised beef in soy sauce
갈비조림,Braised beef rib
소갈비찜,Braised beef ribs
소고기등심떡찜,Braised beef sirloin and rice cake
검정콩조림,Braised black beans
검정콩호두조림,Braised black beans and walnut
순살찜닭,Braised boneless chicken
너비아니조림,Braised bulgogi
우엉조림,Braised burdock 
우엉채조림,Braised burdock slices
우엉어묵조림,Braised burdock and fried fish paste
우엉채어묵조림,Braised burdock slices and fried fish paste
우엉채곤약조림,Braised burdock slices and konjac
우엉조랭이떡조림,Braised burdock slices and mini-ball rice cake
땅콩우엉조림,Braised burdock slices and peanut
우엉간장조림,Braised burdock slices in soy sauce
병어조림,Braised butterfish
어묵당근조림,Braised carrot and fried fish paste
닭가슴살조림,Braised chicken
닭가슴살간장조림,Braised chicken in soy sauce(breast)
닭간장조림,Braised chicken in soy sauce
닭고기간장조림,Braised chicken in soy sauce(meat only)
닭살간장조림,Braised chicken in soy sauce(boneless)
닭떡간장조림,Braised chicken and beef in soy sauce with rice cake
닭살연근조림,Braised chicken and lotus root in soy sauce
닭감자조림,Braised chicken and potato
닭고구마조림,Braised chicken and sweet potato
닭살고구마조림,Braised chicken(meat only) and sweet potato
고구마닭간장조림,Braised chicken and sweet potato in soy sauce
닭가슴살단호박조림,Braised chicken and sweet pumpkin
닭채소조림,Braised chicken and vegetables
닭가슴살호두조림,Braised chicken and walnut
닭봉조림,Braised chicken drumsticks
닭다리살장조림,Braised chicken drumsticks and beef in soy sauce
닭다리살소스조림,Braised chicken drumsticks in sauce
닭봉소스조림,Braised chicken wing in sauce
닭살카레조림,Braised chicken in curry(meat only)
닭살카레튀김,Deep-fried chicken in curry
닭가슴살데리야끼조림,Braised chicken(breast) in teriyaki sauce
닭살데리야끼조림,Braised chicken(meat only) in teriyaki sauce
닭가슴살채소말이조림,Braised chicken roll with vegetables
닭고기장똑똑이,Braised chicken shreds
닭날개조림,Braised chicken wings
닭날개간장조림,Braised chicken wings and beef in soy sauce
닭고기우유조림,Braised chicken with milk
닭살깻잎조림,Braised chicken with perilla leaves
닭감자고구마조림,Braised chicken with potato and sweet potato
명엽채고추장조림,Braised chilli pepper and dried pollack in soy sauce
대구살조림,Braised cod
대구엿장조림,Braised cod in sweet soy sauce
갈치조림,Braised cutlassfish
갈치무조림,Braised cutlassfish and daikon
갈치감자조림,Braised cutlassfish and potato
한치어묵조림,Braised cuttlefish and fried fish paste
오징어간장조림,Braised cuttlefish in soy sauce
무조림,Braised daikon
둥근어묵무조림,Braised daikon and fried fish paste
진미채고추장조림,Braised dried cuttlefish and chilli pepper in soy sauce
진미채간장조림,Braised dried cuttlefish in soy sauce
명엽채조림,Braised dried pollack
건새우조림,Braised dried shrimp
달걀간장조림,Braised eggs in soy sauce
달걀장조림,Eggs boiled down in soy sauce
무화과땅콩조림,Braised fig and peanut
볼어묵조림,Braised fried fish paste bowl
동태무조림,Braised frozen alaska pollock and daikon
임연수무조림,Braised frozen atka mackerel and daikon
마늘쫑조림,Braised garlic stem
두절건새우마늘종조림,Braised garlic stem and dried shrimp
마늘쫑감자조림,Braised garlic stem and potato
다진소고기메추리알조림,Braised ground beef and quail eggs
가자미조림,Braised halibut
가자미무조림,Braised halibut and daikon
가자미양파조림,Braised halibut and onion
가자미양념조림,Braised halibut in marinade sauce
가자미간장조림,Braised halibut with soy sauce
주꾸미간장조림,Braised jukkumi in soy sauce
강낭콩조림,Braised kidney beans
새송이버섯조림,Braised king oyster mushroom
어묵곤약조림,Braised konjac and fried fish paste
메추리알곤약조림,Braised konjac and quail eggs
곤약메추리알장조림,Braised konjac and quail eggs in soy sauce
장산적조림,Braised korean kebab in soy sauce
연근조림,Braised lotus root
땅콩연근조림,Braised lotus root and peanut
연근호두조림,Braised lotus root and walnut
연근간장조림,Braised lotus root in soy sauce
연근엿장조림,Braised lotus root in sweet soy sauce
고등어조림,Braised mackerel
고등어무조림,Braised mackerel and daikon
고등어김치조림,Braised mackerel and kimchi
고등어양념조림,Braised mackerel in marinade sauce
미트볼조림,Braised meat ball
미트볼피망조림,Braised meat ball and paprika
미트볼감자조림,Braised meat ball and potato
동그랑땡채소조림,Braised meat ball and vegetables
미트볼케첩조림,Braised meat ball in ketchup
미트볼토마토소스조림,Braised meat ball in tomato sauce
완자조림,Braised meat dumpling
완자케첩조림,Braised meat dumpling in ketchup
알감자조림,Braised mini-potato
버섯애호박조림,Braised mushroom and zucchini
홍합조림,Braised mussel
모듬견과조림,Braised nuts
견과우엉채조림,Braised nuts and burdock slices
호두견과조림,Braised nuts with walnut
문어조림,Braised octopus
느타리버섯조림,Braised oyster mushrooms
어묵피망조림,Braised paprika and fried fish paste
땅콩조림,Braised peanut
깻잎순조림,Braised perilla leaf
코다리조림,Braised pollack
코다리무조림,Braised pollack and daikon
코다리양념조림,Braised pollack in marinade sauce
동태살엿장조림,Braised pollack in sweet soy sauce
코다리엿장조림,Braised semi dried pollack in sweet soy sauce
돼지고기곤약조림,Braised pork and devil's tongue jelly
돼지고기연근찜,Braised pork and lotus root
돼지고기연근조림,Braised pork and lotus root in soy sauce
돼지고기감자조림,Braised pork and potato
돼지고기표고찜,Braised pork and shiitake mushroom
돼지갈비단호박찜,Braised pork and sweet potato
단호박돼지고기조림,Braised pork and sweet pumpkin
돼지고기단호박조림,Braised pork and sweet pumpkin in soy sauce
돼지고기채소조림,Braised pork and vegetables
돼지고기호두조림,Braised pork and walnut
삼겹살콩나물찜,Braised pork belly and bean sprouts
돼지고기장똑똑이,Braised pork chops
돼지고기장조림,Braised pork in soy sauce
돼지고기장조림(안심),Braised pork in soy sauce (tenderloin)
돼지고기갈비찜,Braised pork rib with soy sauce
떡갈비조림,Braised pork roll with rice cake
떡갈비피망조림,Braised pork roll with rice cake and paprika
떡갈비간장조림,Braised pork roll with rice cake in soy sauce
돼지사태떡찜,Braised pork shank and rice cake
돈사태장조림,Braised pork shank in soy sauce
돼지사태찜,Braised pork shanks
돼지고기스테이크조림,Braised pork steak
감자조림,Braised potato
감자어묵조림,Braised potato and fried fish paste
어묵감자조림,Braised potato and fried fish cake
감자마늘쫑조림,Braised potato and garlic stem
감자비엔나조림,Braised potato and sausage
감자채소조림,Braised potato and vegetables
감자간장조림,Braised potato in soy sauce
치즈감자조림,Braised potato with cheese
메추리알어묵조림,Braised quail eggs and fried fish paste
메추리알볼어묵조림,Braised quail eggs and fried fish paste bowl
메추리알피망케첩조림,Braised quail eggs and paprika in ketchup
메추리알케첩조림,Braised quail eggs in ketchup
메란장조림,Braised quail eggs in soy sauce
메추리알장조림,Quail eggs boiled down in soy sauce
달걀새송이장조림,Braised saesongyi mushroom and eggs in soy sauce
꽁치조림,Braised saury
북어채조림,Braised shredded dried pollack
황태채조림,Braised shredded frozen and dried pollack
새우살조림,Braised shrimp
새우살연근조림,Braised shrimp and lotus root
새우볼조림,Braised shrimp bowl
맛살간장조림,Braised soft crab in soy sauce
삼치조림,Braised spanish mackerel
삼치무조림,Braised spanish mackerel and daikon
삼치살무조림,Braised spanish mackerel(fielet) and daikon
삼치무간장조림,Braised spanish mackerel and daikon in soy sauce
삼치단호박조림,Braised spanish mackerel and sweet pumpkin
삼치살양념조림,Braised spanish mackerel(fielet) in marinade sauce
삼치양념조림,Braised spanish mackerel in marinade sauce
삼치간장조림,Braised spanish mackerel in soy sauce
삼치쌈장조림,Braised spanish mackerel in soy sauce with wraps
삼치엿장조림,Braised spanish mackerel in sweet soy sauce
삼치살데리야끼조림,Braised spanish mackerel in teriyaki sauce
삼치살두부감자조림,Braised spanish mackerel with tofu and potato
닭볶음탕,Braised spicy chicken
순살닭볶음탕,Braised spicy chicken without bones
오징어무조림,Braised squid and radish
고구마조림,Braised sweet potato
어묵고구마조림,Braised sweet potato and fried fish paste
고구마메추리알조림,Braised sweet potato and quail egg
메추리알고구마조림,Braised sweet potato and quail eggs
고구마엿장조림,Braised sweet potato in sweet soy sauce
고구마우유조림,Braised sweet potato with milk
단호박조림,Braised sweet pumpkin
단호박견과류조림,Braised sweet pumpkin and nuts
단호박돼지고기등심조림,Braised sweet pumpkin and pork loin
단호박호두조림,Braised sweet pumpkin and walnut
두부조림,Braised tofu
건새우두부조림,Braised tofu and dried shrimp
두부어묵조림,Braised tofu and fried fish paste
견과두부조림,Braised tofu and nuts
두부땅콩조림,Braised tofu and crashed peanut
땅콩두부조림,Braised tofu and peanut
두부떡간장조림,Braised tofu and rice cake in soy sauce
두부케첩조림,Braised tofu in ketchup
두부양념조림,Braised tofu in marinade sauce
간장두부조림,Braised tofu in soy sauce
두부간장조림,Braised tofu(fried) in soy sauce
매콤두부조림,Braised tofu in spicy sauce
두부데리야끼조림,Braised tofu in teriyaki sauce
깻잎두부조림,Braised tofu with perilla leaves
두부양념찜,Braised tofu with sauce
토마토두부무조림,Braised tomato tofu and daikon
토마토소스닭조림,Braised chicken in tomato sauce
참치어묵조림,Braised tuna and fried fish paste
볼어묵채소조림,Braised vegetables and fried fish paste bowl
뱅어포조림,Braised white bait
뱅어포간장조림,Braised white bait in soy sauce
애호박조림,Braised zucchini
브로콜리스프,Broccoli soup
메밀소바,Buckwheat noodles
온메밀국수,Buckwheat noodles(hot)
불고기,Bulgogi
불고기채소비빔밥,Bulgogi vegetable fried rice
우엉소고기볶음밥,Burdock beef fried rice
우엉주먹밥,Burdock rice ball
건새우우엉주먹밥,Burdock rice ball with dried shrimp
머위들깨국,Butterbur perilla seed soup
양배추오이샐러드,Cabbage and cucumber salad
양배추사과샐러드,Cabbage apple salad
양배추콘샐러드,Cabbage corn salad
양배추초절임,Cabbage in vinegar marinade
양배추백짬뽕국,Cabbage mild seafood noodle soup
양배추샐러드,Cabbage salad
양배추샐러드(레몬드레싱),Cabbage salad (lemon dressing)
양배추샐러드(참깨드레싱),Cabbage salad (sesame dressing)
양배추샐러드(딸기드레싱),Cabbage salad (strawberry dressing)
양배추샐러드(사우전아일랜드드레싱),Cabbage salad (thousand island dressing)
양배추유자청샐러드,Cabbage salad in yuzu marinade
양배추소시지덮밥,Cabbage sausage rice bowl
양배추맑은국,Cabbage soup(clear)
양배추된장국,Cabbage soy paste soup
양배추쌈,Cabbage wraps
케이준샐러드,Cajun salad
유채된장국,Canola soy paste soup
당근황태국,Carrot dried pollack soup
당근스프,Carrot soup
당근스틱,Carrot stick
근대국,Chard soup
근대맑은국,Chard soup(clear)
근대장국수,Chard soy paste noodles
근대된장국,Chard soy paste soup
근대토장국,Chard soup(soy paste+red pepper paste)
치즈돈까스,Cheese cutlet
치즈오믈렛,Cheese omelette
치즈등심돈까스,Cheese pork sirloin cutlet
치즈스크램블에그,cheese scrambled eggs
닭살짜장밥,Chicken black bean paste rice
닭고기곰탕,Chicken bone soup
닭곰탕,Chicken bone broth
닭가슴살샐러드(머스타드소스),Chicken breast (mustard sauce)
닭가슴살미역국,Chicken breast seaweed soup
닭살찹스테이크,Chicken chop steak
치킨까스,Chicken cutlet
치킨까스+소스,Chicken cutlet + sauce
닭고기무국,Chicken daikon soup
닭다리백숙,Chicken drumstick soup
닭살당면국,Chicken glass noodles soup
닭살숙주국,Chicken green bean sprout soup
닭살버섯맑은국,Chicken mushroom soup (clear)
닭칼국수,Chicken noodle soup
치킨너겟+머스타드소스,Chicken nuggets + mustard sauce
치킨너겟+소스,Chicken nuggets + sauce
치킨너겟+토마토케첩,Chicken nuggets + tomato ketchup
닭살양파국,Chicken onion soup
닭살미역국,Chicken seaweed soup
닭꼬치,Chicken skewers
찹쌀닭백숙,Chicken soup with glutinous rice
닭살된장국,Chicken soybean paste soup
닭살시금치국,Chicken spinach soup
닭개장,Chicken stew
맑은닭개장,Chicken stew(clear)
닭살케첩볶음,Chicken stir-fried with ketchup
치킨텐더샐러드(머스타드드레싱),Chicken tender salad (mustard dressing)
닭살데리야끼덮밥,Chicken teriyaki rice bowl
닭살토마토소스덮밥,Chicken tomato rice bowl
닭살토마토스파게티,Chicken tomato spaghetti
닭채소칼국수,Chicken vagetable noodle soup
채소닭고기국,Chicken vegetable soup
닭고기채소찌개,Chicken vegetable stew
닭살채소주먹밥,Chicken veggie rice ball
치킨마요덮밥,Chicken-mayo rice bowl
도토리묵냉국,Chilled acorn jelly soup
