kor,eng
S양파치즈스프,S onion cheese soup
S양파북어죽,S onion dried pollack porridge
S양파타락죽,S onion sweet potato porridge
S오렌지(100g),S orange (100g)
S오렌지(50g),S orange (50g)
S오렌지주스,S orange juice
S오렌지주스(무가당),S orange juice (sugar-free)
S느타리버섯죽,S oyster mushroom porridge
S핫케이크,S pancake
S양배추치즈전,S pan-fried cabbage with cheese
S부추전,S pan-fried chive
S옥수수전,S pan-fried corn
S김치전,S pan-fried kimchi
S연근전,S pan-fried lotus root
S완자전,S pan-fried meat dumpling
S동태전,S pan-fried pollack
S파래전,S pan-fried sea lettuce
S해물파전,S pan-fried seafood and spring onion
S새우채소전,S pan-fried shrimp and vegetables
S단호박전,S pan-fried sweet pumpkin
S채소전,S pan-fried vegetables
S쑥채소전,S pan-fried vegetables with mugwort
S참치채소전,S pan-fried vegetables with tuna
S파프리카감자크림스프,S paprika potato cream soup
S파프리카유부초밥,S paprika rice ball with fried tofu
S파프리카스틱,S paprika stick
S복숭아(60g),S peach (60g)
S복숭아(80g),S peach (80g)
S복숭아(백도)-60g,S peach (white) - 60g
S복숭아(황도)-60g,S peach (yellow) - 60g
S복숭아호두스무디,S peach walnut smoothie
S땅콩,S peanut
S땅콩죽,S peanut porridge
S배(100g),S pear (100g)
S배(50g),S pear (50g)
S들깨죽,S perilla porridge
S들깨누룽지죽,S perilla seed rice crust porridge
S두부들깨죽,S perilla seed tofu porridge
S꼬마김밥(달걀제외),S petite gimbap (no eggs)
S잣죽,S pine nut porridge
S잣찹쌀죽,S pine nut sweet rice porridge
S파인애플(50g),S pineapple (50g)
S피자빵,S pizza bread
S자두(50g),S plum (50g)
S동태살죽,S pollack porridge
S돼지고기채소죽,S pork veggie porridge
S감자치즈죽,S potato cheese porridge
S감자죽,S potato porridge
S감자건포도샐러드,S potato raisin salad
S감자샐러드,S potato salad
S감자된장죽,S potato soy paste porridge
S감자우유죽,S potato sweet milk porridge
S감자찹쌀죽,S potato sweet rice porridge
S감자채소죽,S potato vagetable porridge
S감자채요거트샐러드,S potato yoghurt salad
S절편,S pounded rice cake
S절편(40g),S pounded rice cake (40g)
S늙은호박죽,S pumpkin porridge
S표고버섯죽,S pyogo mushroom porridge
S무지개떡,S rainbow rice cake
S무지개떡(40g),S rainbow rice cake (40g)
S건포도감자볼,S raisin potato bowl
S단팥죽,S sweet red bean porridge
S팥죽,S red bean porridge
S주먹밥,S rice ball
S유부초밥,S rice ball with fried tofu
S참나물유부초밥,S rice ball with fried tofu and spring parsley
S김가루주먹밥,S rice ball with seaweed flakes
S떡국,S rice cake soup
S개피떡,S rice cake with bean paste
S개피떡(40g),S rice cake with bean paste (40g)
S쌀과자,S rice cracker
S누룽지치즈죽,S rice crust cheese  porridge
S누룽지죽,S rice crust porridge
S쌀국수,S rice noodles
S흰죽,S rice porridge
S식혜,S rice punch
S도토리묵밥,S rice with chilled acorn jelly soup
S온도토리묵밥,S rice with hot acorn jelly soup
S쌀음료,S rice-based beverage
S쌀씨리얼,S rice-based cereal
S웨지감자구이,S roasted potato wedge
S버터감자구이,S roasted potato with butter
S로제스파게티,S rose spaghetti
S궁중떡볶이,S royal-style tteokbokki (stir-fried rice cake)
S새송이버섯죽,S saesongyi mushroom porridge
S명란죽,S salted pollack roe porridge
S샌드위치,S sandwich
S스크램블에그(버터),S scrambled egg (butter)
S스크램블에그,S scrambled eggs
S시금치스크램블에그,S scrambled eggs with spinach
S토마토스크램블에그,S scrambled eggs with tomato
S채소스크램블에그,S scrambled eggs with vegetables
S파래죽,S sea lettuce porridge
S해물죽,S seafood porridge
S간장소면무침,S seasoned noodles in soy-sauce
S도토리묵무침,S seasoned salad with acorn jelly
S미역죽,S seaweed porridge
S미역채소죽,S seaweed veggie porridge
S다시마흰살생선죽,S brown kelp white fish porridge
S씨앗호떡,S seed-filled fried pancake
S참깨크림스프,S sesame cream soup
S참깨우유스프,S sesame milk soup
S깨죽,S sesame porridge
S참깨죽,S deluxe sesame porridge
S참깨스프,S sesame soup
S참깨타락죽,S sesame sweet potato porridge
S참깨채소죽,S sesame veggie porridge
S새우치즈죽,S shrimp cheese porridge
S새우볶음밥,S shrimp fried rice
S새우살죽,S shrimp porridge
S새우죽,S shrimp porridge with vegetables
S밥새우주먹밥,S shrimp flakes rice ball
S새우주먹밥,S shrimp rice ball
S새우채소죽,S shrimp vagetable porridge
S새우애호박죽,S shrimp zucchini porridge
S시루떡,S sirutteok
S백설기,S snow white rice cake
S백설기(80g),S snow white rice cake (80g)
S소보로빵,S soboro bun (streusel-like crusted bread)
S게살치즈죽,S soft crab cheese porridge
S게살죽,S soft crab porridge
S크래미게살죽,S crab sticks porridge
S게살채소스프,S soft crab veggie soup
S연두부+양념장,S soft tofu + marinade sauce
S연두부게살스프,S soft tofu crap soup
S순두부죽,S unpressed tofu porridge
S연두부죽,S soft tofu porridge
S연두부샐러드(오리엔탈드레싱),S soft tofu salad (oriental dressing)
S순두부채소죽,S unpressed veggie porridge
S연두부채소죽,S soft tofu veggie porridge
S둥글레차,S solomon's seal tea
S콩두유,S soy milk
S두유(100ml),S soy milk (100ml)
S두유(150ml),S soy milk (150ml)
S두유(200ml),S soy milk (200ml)
S장국죽,S soy paste porridge
S간장닭강정,S soy-based deep-fried chicken nuggets
S간장비빔국수,S soy-based mixed noodles
S간장떡볶이,S soy-based tteokbokki (stir-fried rice cake)
S대두콩죽,S soybean porridge
S시금치치즈죽,S spinach cheese porridge
S시금치크림스프,S spinach cream soup
S시금치견과류주먹밥,S spinach nuts rice ball
S시금치죽,S spinach porridge
S시금치감자죽,S spinach potato porridge
S시금치스프,S spinach soup
S시금치된장죽,S spinach soy paste porridge
S시금치스프레드식빵피자,S spinach spread white bread pizza
S카스텔라,S sponge cake
S참나물죽,S spring parsley porridge
S찐빵,S steamed bread
S채소찐빵,S steamed bread with vegetables
S찐밤,S steamed chestnut
S찐옥수수,S steamed corn
S찐만두,S steamed mandu (dumpling)
S찐감자,S steamed potato
S노란시루떡,S steamed rice cake
S밤설기,S steamed rice cake with chestnut
S밤설기(40g),S steamed rice cake with chestnut (40g)
S쑥버무리,S steamed mugwort with sweet rice powder
S쑥설기,S steamed rice cake with mugwort
S쑥설기(40g),S steamed rice cake with mugwort (40g)
S찐고구마,S steamed sweet potato
S찐고구마(80g),S steamed sweet potato (80g)
S단호박찜,S steamed sweet pumpkin
S단호박견과류찜,S steamed sweet pumpkin with nuts
S볶음현미죽,S stir-fried brown rice porridge
S어묵잡채,S stir-fried fish cake and glass noodles
S마늘종잡채,S stir-fried garlic scapes and glass noodles
S피망잡채,S stir-fried paprika and glass noodles
S돼지고기잡채,S stir-fried pork with glass noodles
S해물굴소스볶음밥,S stir-fried rice in oyster sauce
S우엉채소볶음밥,S stir-fried rice with burdock and vegetables
S닭가지볶음밥,S stir-fried rice with chicken and aubergine
S달걀볶음밥,S stir-fried rice with eggs
S달걀채소볶음밥,S stir-fried rice with eggs and vegetables
S주꾸미미나리볶음밥,S stir-fried rice with jukkumi and water celery
S김치볶음밥,S stir-fried rice with kimchi
S새우채소볶음밥,S stir-fried rice with shrimp and vegetables
S참치가지볶음밥,S stir-fried rice with tuna and aubergine
S볶음우동,S stir-fried udon (white wheat noodles)
S딸기(100g),S strawberry (100g)
S딸기쨈식빵,S strawberry jam bread
S수제비,S sujebi
S들깨수제비,S sujebi with perilla seeds
S열무죽,S summer radish porridge
S수리취떡,S surichui rice cake
S수리취떡(40g),S surichui rice cake (40g)
S녹차밤양갱,S sweet green tea and chestnut jelly
S단감(50g),S sweet persimmon (50g)
S고구마청경채죽,S sweet potato bokchoy porridge
S고구마경단,S sweet potato dango
S고구마맛탕,S sweet potato mattang (sugar-glazed deep-fried sweet potato wedge)
S고구마죽,S sweet potato porridge
S고구마타락죽,S sweet potato porridge with milk
S타락죽,S milk porridge
S고구마샐러드(마요네즈),S sweet potato salad (mayonnaise)
S으깬견과류고구마샐러드(요거트),S sweet potato salad with crushed nuts (yoghurt)
S고구마쉐이크,S sweet potato shake
S고구마스프,S sweet potato soup
S고구마두부죽,S sweet potato tofu porridge
S단호박크림리조또,S sweet pumpkin cream risotto
S단호박크림스프,S sweet pumpkin cream soup
S단호박꿀찜,S sweet pumpkin honey steam
S단호박죽,S sweet pumpkin porridge
S단호박떡케익,S sweet pumpkin rice cake-based cake
S단호박식혜,S sweet pumpkin rice punch
S단호박샐러드,S sweet pumpkin salad
S단호박샐러드(마요네즈),S sweet pumpkin salad (mayonnaise)
S단호박스프,S sweet pumpkin soup
S단호박설기,S sweet pumpkin steamed rice cake
S단팥빵,S sweet red bean bun
S단팥도너츠,S sweet red bean doughnut
S찹쌀닭죽,S sweet rice chicken porridge
S찹쌀도너츠,S sweet rice doughnut
S김가루찹쌀죽,S sweet rice porridge with seaweed flakes
S찹쌀고구마죽,S sweet rice sweet potato porridge
S찹쌀단호박죽,S sweet rice sweet pumpkin porridge
S귤(50g),S tangerine (50g)
S토스트,S toast
S식빵토스트,S toasted bread
S두부,S tofu
S두부부추죽,S tofu chive porridge
S두부죽,S tofu porridge
S연두부,S tofu pudding
S두부채소죽,S tofu vagetable porridge
S토마토(100g),S tomato (100g)
S토마토(200g),S tomato (200g)
S토마토주스,S tomato juice
S토마토쉐이크,S tomato shake
S토마토스파게티,S tomato spaghetti
S토마토두부샐러드,S tomato tofu salad
S떡볶이,S tteokbokki (stir-fried rice cake)
S참치죽,S tuna porridge
S참치주먹밥,S tuna rice ball
S참치밥전,S tuna rice pancake
S참치미역죽,S tuna seaweed porridge
S참치채소죽,S tuna veggie porridge
S우동,S udon (white wheat noodles)
S해물볶음우동,S udon (white wheat noodles) with stir-fried seafood
S베지밀,S vegemil
S채소죽,S veggie porridge
S김가루채소죽,S veggie porridge with seaweed flakes
S채소주먹밥,S veggie rice ball
S채소스프,S veggie soup
S호두,S walnut
S호두치즈죽,S walnut cheese porridge
S호두오곡죽,S walnut five-grain porridge
S호두우유,S walnut milk
S호두죽,S walnut porridge
S호두찹쌀죽,S walnut sweet rice porridge
S호두두부쉐이크,S walnut tofu shake
S호두채소죽,S walnut veggie porridge
S수박(100g),S watermelon (100g)
S수박화채,S watermelon punch
S(우유제외)수박화채,S watermelon punch (without milks)
S흰살생선죽,S white fish porridge
S복숭아(백도)-80g,S white peach -80g
S닭백숙,S whole chicken soup
S얼갈이된장죽,S winter cabbage miso porridge
S얼갈이배추죽,S winter cabbage porridge
S약과,S yakgwa (honey cookie)
S약식,S yaksik (sweet rice with jujube)
S요구르트,S yakult
S양송이치즈죽,S yangsongyi mushroom cheese porridge
S양송이크림스프,S yangsongyi mushroom cream soup
S양송이버섯죽,S button mushroom porridge
S양송이죽,S button mushroom porridge(soy sauce)
S양송이버섯스프,S button mushroom soup with vegetable
S양송이스프,S button mushroom soup
S양송이채소죽,S yangsongyi mushroom veggie porridge
S복숭아(황도)-80g,S yellow peach-80g
S떠먹는요구르트(100ml),S yoghurt (100ml)
S유자차,S yuzu tea
S애호박죽,S young pumpkin porridge
S호박죽,S old pumpkin porridge
S애호박감자죽,S zucchini potato porridge
S애호박김죽,S zucchini seaweed flake porridge
S애호박다시마죽,S zucchini brown kelp porridge
S애호박두부죽,S zucchini tofu porridge
새송이버섯국,Saesongyi mushroom soup
연어스테이크,Salmon steak
가자미소금구이,Salt grilled halibut
건파래자반,Salted dried sea lettuce
파래자반,Salted sea lettuce
김자반,Salted seaweed
김국,Salted seaweed soup
새우젓국찌개,Salted shrimp soup or stew
비엔나브로콜리꼬지,Sausage broccoli skewers
소떡소떡,Sausage rice cake skewers
부대찌개,Sausage stew
어린이부대찌개,Sausage stew for kids
스크램블에그,Scrambled eggs
베이컨스크램블에그,Scrambled eggs with bacon
파프리카스크램블에그,Scrambled eggs with paprika
새우살스크램블에그,Scrambled eggs with shrimp
게살스크램블에그,Scrambled eggs with soft crab
맛살스크램블에그,Scrambled eggs with crab sticks
시금치스크램블에그,Scrambled eggs with spinach
토마토스크램블에그,Scrambled eggs with tomato
채소스크램블에그,Scrambled eggs with vegetables
세발나물,Sea spurrey
해물버섯덮밥,Seafood mushroom rice bowl
해물칼국수,Seafood noodle soup
해산물칼국수,Seafood(+shrimp) noodle soup
해물탕,Seafood soup
청포묵숙주김무침,"Seaseond mungbean jelly, green bean sprouts, and roasted seaweed"
가지들깨나물,Seasoned aubergine and perilla seed
콩나물당근무침,Seasoned bean sprout and carrot
소고기청포묵무침,Seasoned beef and mungbean jelly
소고기김무침,Seasoned beef and roasted seaweed
도라지나물,Seasoned bellflower root
도라지들깨나물,Seasoned bellflower root and perilla seed
청경채나물,Seasoned bokchoy
브로콜리나물,Seasoned broccoli
머위나물,Seasoned butterbur
양배추나물,Seasoned cabbage
양배추맛살나물,Seasoned cabbage and soft crab
양배추호두무침,Seasoned cabbage and walnuts
양배추된장나물,Seasoned cabbage in soy paste
유채나물,Seasoned canola
당근숙주나물,Seasoned carrot and green bean sprout
근대나물,Seasoned chard
부추나물,Seasoned chive
쑥갓나물,Seasoned crown daisy(soy sauce)
쑥갓팽이버섯나물,Seasoned crown daisy and winter mushroom
오이나물,Seasoned cucumber
무나물,Seasoned daikon
들깨무나물,Seasoned daikon and perilla seed
표고버섯무나물,Seasoned daikon and pyogo mushroom
시래기나물,Seasoned dried radish leaves
시래기들깨나물,Seasoned dried radish leaves and perilla seed
머윗대나물,Seasoned fuki stem
머윗대들깨나물,Seasoned fuki stem and perilla seed
숙주나물,Seasoned green bean sprout
숙주당근나물,Seasoned green bean sprout and carrot
숙주맛살나물,Seasoned green bean sprout and soft crab
미나리나물,Seasoned winter celery
미나리숙주나물,Seasoned water dropwort and green bean sprout 
숙주미나리나물,Seasoned green bean sprout and winter celery
가지나물,Seasoned herbs with aubergine
참외나물,Seasoned korean melon
비빔만두,Seasoned mandu (dumpling)
모듬버섯나물,Seasoned mushroom
버섯들깨나물,Seasoned mushroom and perilla seed
배추나물,Seasoned napa cabbage
노각나물,Seasoned overripe cucumber
느타리버섯나물,Seasoned oyster mushroom
고춧잎나물,Seasoned pepper leaf
깻순나물,Seasoned perilla leaf(sprouts)
깻잎나물,Seasoned perilla leaf
깻잎들깨나물,Seasoned perilla leaf and perilla seed
조미김,Seasoned roasted seaweed
새송이버섯나물,Seasoned saesongyi mushroom
고사리들깨나물,Seasoned salad bracken with perilla seeds
땅콩우엉무침,Seasoned salad burdock slices and peanut
도토리묵무침,Seasoned salad with acorn jelly
도토리묵김무침,Seasoned salad with acorn jelly and laver
도토리묵채소무침,Seasoned salad with acorn jelly and vegetables
도토리묵간장무침,Seasoned salad with acorn jelly in soy sauce
사과치커리무침,Seasoned salad with apple and chicory
사과상추무침,Seasoned salad with apple and lettuce
사과미나리무침,Seasoned salad with apple and winter celery
가지나물무침,Seasoned salad with aubergine
가지무침,Seasoned salad with egg plant
가지양념무침,Seasoned salad with aubergine in marinade sauce
콩나물무침,Seasoned salad with bean sprout
콩나물김무침,Seasoned salad with bean sprout and salted seaweed
콩나물맛살무침,Seasoned salad with bean sprout and soft crab
콩나물간장무침,Seasoned salad with bean sprout in soy sauce
도라지무침,Seasoned salad with bellflower root
도라지오이무침,Seasoned salad with bellflower root and cucumber
도라지배무침,Seasoned salad with bellflower root and pear
도라지오징어채무침,Seasoned salad with bellflower root and sliced cuttlefish
청경채무침,Seasoned salad with bokchoy
청경채도토리묵무침,Seasoned salad with bokchoy and acorn jelly
청경채사과무침,Seasoned salad with bokchoy and apple
청경채느타리무침,Seasoned salad with bokchoy and oyster mushroom
청경채된장무침,Seasoned salad with bokchoy in soy paste
청경채초무침,Seasoned salad with bokchoy in vinegar marinade
브로콜리무침,Seasoned salad with broccoli
브로콜리오징어무침,Seasoned salad with broccoli and cuttlefish
브로콜리애느타리무침,Seasoned salad with broccoli and oyster mushroom
브로콜리참깨무침,Seasoned salad with broccoli and sesame
브로콜리두부무침,Seasoned salad with broccoli and tofu
브로콜리흑임자소스무침,Seasoned salad with broccoli in black sesame sauce
브로콜리초고추장무침,Seasoned salad with broccoli in red chilli paste with vinegar
브로콜리깨소스무침,Seasoned salad with broccoli in sesame sauce
브로콜리된장무침,Seasoned salad with broccoli in soy paste
브로콜리초무침,Seasoned salad with broccoli in vinegar marinade
브로콜리새우깨무침,Seasoned salad with broccoli shrimp and sesame
양배추무침,Seasoned salad with cabbage
양배추오이무침,Seasoned salad with cabbage and cucumber
양배추마요무침,Seasoned salad with cabbage in mayonnaise
양배추된장무침,Seasoned salad with cabbage in soy paste
양배추쌈장무침,Seasoned salad with cabbage in soy red chilli paste
양배추유자청무침,Seasoned salad with cabbage in yuzu marinade
양배추채무침,Seasoned salad with cabbage slices
유채나물무침,Seasoned salad with canola
유채나물된장무침,Seasoned salad with canola in soy paste
당근참치마요무침,Seasoned salad with carrot and tuna in mayonnaise
근대나물무침,Seasoned salad with chard
근대나물된장무침,Seasoned salad with chard in soy paste
닭가슴살사과무침,Seasoned salad with chicken and apple
닭가슴살부추무침,Seasoned salad with chicken and chive
치커리무침,Seasoned salad with chicory
치커리사과무침,Seasoned salad with chicory and apple
치커리부추무침,Seasoned salad with chicory and chive
치커리배무침,Seasoned salad with chicory and pear
치커리유자청무침,Seasoned salad with chicory in yuzu marinade
부추사과무침,Seasoned salad with chive and apple
부추양파무침,Seasoned salad with chive and onion
부추배무침,Seasoned salad with chive and pear
김가루부추무침,Seasoned salad with chive and seaweed flakes
생취나물무침,Seasoned salad with chwinamul(raw)
취나물무침,Seasoned salad with chwinamul(dried)
취나물들깨무침,Seasoned salad with chwinamul and perilla seed
취나물된장무침,Seasoned salad with chwinamul in soy paste
닭고기냉채,Seasoned salad with cold chicken
훈제오리냉채,Seasoned salad with cold smoked duck
동부묵무침,Seasoned salad with cowpea
쑥갓나물무침,Seasoned crown daisy
쑥갓무침,Seasoned salad with crown daisy
쑥갓들깨무침,Seasoned salad with crown daisy and perilla seed
쑥갓두부무침,Seasoned salad with crown daisy and tofu
오이무침,Seasoned salad with cucumber
오이사과무침,Seasoned salad with cucumber and apple
오이청경채무침,Seasoned salad with cucumber and bokchoy
오이양배추무침,Seasoned salad with cucumber and cabbage
오이당근무침,Seasoned salad with cucumber and carrot
오이치커리무침,Seasoned salad with cucumber and chicory
오이부추무침,Seasoned salad with cucumber and chive
오이양파무침,Seasoned salad with cucumber and onion
오이파프리카무침,Seasoned salad with cucumber and paprika
오이미역초무침,Seasoned salad with cucumber and seaweed in vinegar marinade
오이맛살무침,Seasoned salad with cucumber and soft crab
오이참치마요무침,Seasoned salad with cucumber and tuna in mayonnaise
오이달래무침,Seasoned salad with cucumber and wild chive
오이쌈장무침,Seasoned salad with cucumber in soy red chilli paste
오이유자청무침,Seasoned salad with cucumber in yuzu marinade
오이깍둑무침,Seasoned salad with cucumber kimchi cubes
아욱나물무침,Seasoned curled mallow
아욱무침,Seasoned salad with curled mallow
아욱된장무침,Seasoned salad with curled mallow in soy paste
오징어무침,Seasoned salad with cuttlefish
오징어단무지무침,Seasoned salad with cuttlefish and pickled daikon
오징어초무침,Seasoned salad with cuttlefish in vinegar marinade
오징어채무침,Seasoned salad with cuttlefish slices
오징어실채무침,Seasoned salad with cuttlefish thin slices
무사과무침,Seasoned salad with daikon and apple
무미역무침,Seasoned salad with daikon and seaweed
더덕사과무침,Seasoned salad with deodeok and apple
진미채무침,Seasoned salad with dried cuttlefish
진미채무말랭이무침,Seasoned salad with dried cuttlefish and dried radish
진미채채소무침,Seasoned salad with dried cuttlefish and vegetables
진미채초무침,Seasoned salad with dried cuttlefish in vinegar marinade
쥐포무침,Seasoned salad with dried filefish
북어채무침,Seasoned salad with dried pollack slices
무말랭이무침,Seasoned salad with dried radish
무몰무침,Seasoned salad with radish and gulf weed
시래기된장무침,Seasoned salad with dried radish leaves in soy paste
건파래무침,Seasoned salad with dried sea lettuce
오색묵무침,Seasoned salad with five-color acorn jelly
골뱅이무침,Seasoned salad with freshwater snails
어묵오징어무침,Seasoned salad with fried fish paste and cuttlefish
유부맛살숙주무침,Seasoned salad with fried tofu soft crab and green bean sprout
마늘쫑무침,Seasoned salad with garlic stem
숙주나물무침,Seasoned salad with green bean sprout
숙주나물김무침,Seasoned salad with green bean sprout and salted seaweed
숙주맛살무침,Seasoned salad with green bean sprout and soft crab
숙주초무침,Seasoned salad with green bean sprout in vinegar marinade
가지구이무침,Seasoned salad with grilled aubergine
톳나물무침,Seasoned salad with hijiki
톳두부무침,Seasoned salad with hijiki and tofu
콜라비사과무침,Seasoned salad with kohlrabi and apple
곤약김치무침,Seasoned salad with konjac and kimchi
참외노각무침,Seasoned salad with korean melon and overripe cucumber
상추무침,Seasoned salad with lettuce
도토리묵상추무침,Seasoned salad with lettuce and acorn jelly and vegetables 
상추묵무침,Seasoned salad with lettuce and acorn jelly
상추사과무침,Seasoned salad with lettuce and apple
상추사과초무침,Seasoned salad with lettuce and apple in vinegar marinade
상추부추무침,Seasoned salad with lettuce and chive
상추쑥갓무침,Seasoned salad with lettuce and crown daisy
상추오이무침,Seasoned salad with lettuce and cucumber
상추초무침,Seasoned salad with lettuce in vinegar marinade
상추유자청무침,Seasoned salad with romein in yuzu marinade
양상추유자청무침,Seasoned salad with lettuce in yuzu marinade
연근들깨무침,Seasoned salad with lotus root and perilla seed
연근흑임자소스무침,Seasoned salad with lotus root in black sesame sauce
연근유자청무침,Seasoned salad with lotus root in yuzu marinade
미니새송이버섯무침,Seasoned salad with mini-saesongyi mushroom
청포묵무침,Seasoned salad with mung bean jelly
탕평채무침,Seasoned mung bean jelly and vegetables
청포묵김무침,Seasoned salad with mung bean jelly and salted seaweed
배추된장무침,Seasoned salad with napa cabbage in soy paste
견과류시금치무침,Seasoned salad with nuts and spinach
노각무침,Seasoned salad with overripe cucumber
느타리버섯무침,Seasoned salad with oyster mushroom
느타리버섯김무침,Seasoned salad with oyster mushroom and salted seaweed
파프리카무침,Seasoned salad with paprika
파프리카사과초무침,Seasoned salad with paprika and apple in vinegar marinade
파프리카쌈장무침,Seasoned salad with paprika in soy red chilli paste
파프리카초무침,Seasoned salad with paprika in vinegar marinade
파프리카유자청무침,Seasoned salad with paprika in yuzu marinade
고춧잎된장무침,Seasoned salad with pepper leaf in soy paste
깻잎나물무침,Seasoned salad with perilla leaves
깻잎새콤무침,Seasoned salad with perilla leaves in vinegar marinade
들깨오이무침,Seasoned salad with perilla seeds and cucumber
새우살들깨무침,Seasoned salad with perilla seeds and shrimp
단무지무침,Seasoned salad with pickled daikon
비름나물된장무침,Seasoned salad with pig weed in soy paste
비름나물무침,Seasoned salad with pigweed
김무침,Seasoned salad with salted seaweed
파래무침,Seasoned salad with sea lettuce
파래무채무침,Seasoned salad with sea lettuce and sliced daikon
세발나물무침,Seasoned salad with sea spurrey
