kor,eng
세발나물된장무침,Seasoned salad with sea spurrey in soy paste
세발나물초무침,Seasoned salad with sea spurrey in vinegar marinade
미역무침,Seasoned salad with seaweed
미역매실청무침,Seasoned salad with seaweed in green plum marinade
미역초무침,Seasoned salad with seaweed in vinegar marinade
다시마채무침,Seasoned salad with brown kelp slices
돌나물무침,Seasoned salad with sedum
돌나물부추무침,Seasoned salad with sedum and chive
돌나물오이무침,Seasoned salad with sedum and cucumber
돌나물초무침,Seasoned salad with sedum in vinegar marinade
돌나물유자청무침,Seasoned salad with sedum in yuzu marinade
냉이무침,Seasoned salad with shepherd's purse
냉이된장무침,Seasoned salad with shepherd's purse in soy paste
새우살채소깨무침,Seasoned salad with shrimp sesame and vegetables
무채무침,Seasoned salad with sliced daikon
훈제오리무침,Seasoned salad with smoked duck
맛살무침,Seasoned salad with soft crab
맛살콩나물무침,Seasoned salad with soft crab and bean sprout
크래미숙주나물무침,Seasoned salad with soft crab and green bean sprout
맛살채소새콤무침,Seasoned salad with soft crab and vegetables in vinegar marinade
맛살미나리무침,Seasoned salad with soft crab and winter celery
게살마요무침,Seasoned salad with soft crab in mayonnaise
매콤콩나물무침,Seasoned salad with spicy bean sprout
쫄면무침,Seasoned salad with spicy chewy noodles
매콤숙주오이무침,Seasoned salad with spicy green bean sprout and cucumber
매콤숙주미나리무침,Seasoned salad with spicy green bean sprout and winter celery
시금치김무침,Seasoned salad with spinach and salted seaweed
봄동무침,Seasoned salad with spring cabbage
실파김무침,Seasoned salad with spring onion and salted seaweed
참나물무침,Seasoned salad with spring parsley
참나물들깨무침,Seasoned salad with spring parsley and perilla seed
참나물된장무침,Seasoned salad with spring parsley in soy paste
참나물간장무침,Seasoned salad with spring parsley in soy sauce
참나물유자청무침,Seasoned salad with spring parsley in yuzu marinade
열무들깨무침,Seasoned salad with summer radish and perilla seed
열무된장무침,Seasoned salad with summer radish in soy paste
단배추된장무침,Seasoned salad with sweet napa cabbage in soy paste
고구마순된장무침,Seasoned salad with sweet potato stem in soy paste
실곤약채소무침,Seasoned salad with thred konjac and vegetables
실곤약간장채소무침,Seasoned salad with thred konjac and vegetables in soy sauce
삼색초무침,Seasoned salad with three-color herbs
두부쑥갓무침,Seasoned salad with tofu and crown daisy
두부들깨무침,Seasoned salad with tofu and perilla seed
두부미역무침,Seasoned salad with tofu and seaweed
두부톳무침,Seasoned salad with tofu and seaweed fusiforme
토마토치커리무침,Seasoned salad with tomato and chicory
소면채소무침,Seasoned salad with vegetables and plain noodles
쫄면채소무침,Seasoned salad with vegetables and spicy chewy noodles
물미역무초무침,Seasoned salad with wated seaweed in vinegar marinade
달래무침,Seasoned salad with wild chive
달래김무침,Seasoned salad with wild chive and salted seaweed
얼갈이무침,Seasoned salad with winter cabbage
미나리무침,Seasoned salad with winter celery
미나리사과무침,Seasoned salad with winter celery and apple
미나리초무침,Seasoned salad with winter celery in vinegar marinade
동초무침,Seasoned salad with winter herbs
겨울초된장무침,Seasoned salad with winter herbs in soy paste
팽이버섯무침,Seasoned salad with winter mushroom
미역나물,Seasoned seaweed
돌나물사과무침,Seasoned sedum and apples
냉이나물,Seasoned shepherd's purse
표고버섯나물,Seasoned shiitake mushrooms
시금치나물,Seasoned spinach
봄동나물,Seasoned spring cabbage
단배추나물,Seasoned sweet napa cabbage
고구마순들깨나물,Seasoned sweet potato stem and perilla seed
곤드레나물,Seasoned thistle
삼색나물,Seasoned three-color herbs
얼갈이나물,Seasoned winter cabbage
얼갈이된장나물,Seasoned winter cabbage in soy paste
팽이버섯나물,Seasoned winter mushroom
팽이버섯부추나물,Seasoned winter mushroom and chive
애호박나물,Seasoned young pumpkin
호박고지나물,Seasoned dried pumpkin
호박나물,Seasoned zucchini
다시마무채국,Brown kelp daikon soup
미역북어국,Seaweed dried pollack soup
매생이수제비국,Seaweed fulvescens sujebi soup
매생이두부국,Seaweed fulvescens tofu soup
미역만두국,Seaweed mandu (dumpling) soup
미역미소장국,Seaweed miso paste soup
다시마양파국,Brown kelp and onion soup
다시마감자국,Brown kelp and potato soup
다시마새우젓국,Brown kelp and salted shrimp soup
다시마채국,Brown kelp and soup
맑은미역국,Seaweed soup(clear)
미역국,Seaweed soup
소고기미역국,Seaweed soup with beef
미역된장국,Seaweed soy paste soup
미역장국,Seaweed miso soup
미역참치국,Seaweed tuna soup
돌나물흑임자샐러드,Sedum and black sesame salad
돌나물과일샐러드,Sedum fruit salad
재첩국,Shellfish soup
냉이콩나물된장국,Shepherd's purse bean sprout soy paste soup
냉이국,Shepherd's purse soup
냉이된장국,Shepherd's purse soy paste soup
표고버섯무국,Shiitake mushroom radish soup
표고버섯탕,Shiitake mushroom stew
갈비탕,Short rib beef soup
소갈비탕,Short rib beef soup(plate)
갈비탕+당면,Short rib beef soup + glass noodles
모시조개국,Short-necked clam(shell-less) soup
북어채국,Shredded dried pollack soup
양파채국,Shredded onion soup
감자채국,Shredded potato soup
무채된장국,Shredded radish bean paste soup
무채양파국,Shredded radish onion soup
무채국,Shredded radish soup
새우크림스파게티,Shrimp cream spaghetti
새우까스,Shrimp cutlet
새우까스+타르타르소스,Shrimp cutlet + tartar sauce
새우살무국,Shrimp daikon soup
새우탕수,Shrimp dumpling
새우달걀국,Shrimp egg soup
새우감바스,Shrimp gambas
새우살부추국,Shrimp korean-leeks soup
새우버섯덮밥,Shrimp mushroom rice bowl
밥새우주먹밥,Shrimp rice ball
새우살미역국,Shrimp seaweed soup
새우맑은국,Shrimp soup
새우살시금치국,Shrimp spinach soup
새우두부탕국,Shrimp tofu soup
새우살두부국,Shrimp tofu stew
새우굴소스채소볶음밥,Shrimp vegetable fried rice made with oyster sauce
새우살애호박국,Shrimp zucchini soup
소고기등심버섯불고기,Sirloin bulgogi with mushroom
꼬치어묵국,Skewered fish cake soup
"물만두국(달걀제외,가공만두)","Small dumpling soup (no eggs, processed dumplings)"
소보로덮밥,Soboro rice bowl
크래미채소샐러드,Soft crab and vegetable salad
게맛살크로켓,Soft crab croquette
맛살양상추샐러드,Soft crab lettuce salad
게살샐러드,Soft crab salad
크래미유자샐러드,Soft crab yuzu salad
연두부찜,Soft steamed tofu
연두부+흑임자소스,Soft tofu + black sesame sauce
순두부+양념장,Unpressed tofu + marinade sauce
연두부+양념장,Soft tofu + marinade sauce
연두부달걀탕,Soft tofu and eggs soup
연두부부추국,Soft tofu and korean-leeks soup
순두부애호박국,Unpressed tofu and zucchini soup
연두부청경채새우탕,Soft tofu bokchoy shrimp soup
연두부게살스프,Soft tofu crap soup
순두부낙지연포탕,Unpressed tofu octopus soup
연두부샐러드(오리엔탈드레싱),Soft tofu salad (oriental dressing)
연두부새우젓국,Soft tofu salted shrimp soup
연두부새우탕,Soft tofu shrimp soup
맑은순두부국,Unpressed soup(clear)
순두부국,Unpressed tofu soup
연두부맑은국,Soft tofu soup(clear)
연두부탕,Soft tofu soup
순두부백탕,Unpressed soup (mild flavor)
연두부된장찌개,Soft tofu soy paste stew
순두부찌개,Unpressedtofu stew
탕국,Soup
우렁된장소스덮밥,Soy paste rice bowl with freshwater snails
연두부된장덮밥,Soy paste rice bowl with soft tofu
맑은장국,Soy paste soup
게살된장우동,Soy paste udon (white wheat noodles) with soft crab
강된장,Soy paste with beef and mushroom
콩비지맑은국,Soy puree soup
콩비지찌개,Soy puree stew
돼지고기간장불고기,Soy sauce-based pork bulgogi
소고기장조림,Soy sauce-braised beef
소고기달걀장조림,Soy sauce-braised beef and eggs
소고기버섯장조림,Soy sauce-braised beef and mushroom
소고기메추리알장조림,Soy sauce-braised beef and quail eggs
소고기꽈리장조림,Soy sauce-braised beef and shishito peppers
소고기사태장조림,Soy sauce-braised beef shank
돼지고기간장조림,Soy sauce-braised pork
돼지고기양송이장조림,Soy sauce-braised pork and button mushrooms
돼지고기달걀장조림,Soy sauce-braised pork and egg
돼지고기새송이버섯장조림,Soy sauce-braised pork and king oyster mushrooms
돼지고기메추리알장조림,Soy sauce-braised pork and quail eggs
돼지고기무채장조림,Soy sauce-braised pork and shredded radish
오징어달걀장조림,Soy sauce-braised squid and eggs
된장찌개,Soy stew
간장마파두부,Soy-based mapa tofu
간장비빔국수,Soy-based mixed noodles
새우간장덮밥,Soy-based shrimp rice bowl
간장떡볶이,Soy-based tteokbokki (stir-fried rice cake)
소고기된장국,Soybean paste soup with beef
새송이버섯된장국,Soybean paste soup with king oyster mushrooms
표고버섯된장국,Soybean paste soup with shiitake mushroom
매콤오삼불고기,Spicy barbequed pork belly and cuttlefish
매콤콩나물국,Spicy bean sprout soup
매콤소고기숙주국,Spicy beef bean sprout soup
매콤육개장,Spicy beef stew
매콤북어국,Spicy dried pollack soup
매콤어묵국,Spicy fish cake soup
오리주물럭,Spicy marinated duck
맑은짬뽕국,Spicy seafood noodle soup(clear)
해물짬뽕국,Spicy seafood noodle soup
매콤오징어국,Spicy squid soup
닭갈비구이,Spicy stir-fried chicken
닭갈비덮밥,Spicy stir-fried chicken over rice
매콤애호박국,Spicy zucchini soup
시금치북어국,Spinach and dried pollack soup
시금치소고기덮밥,Spinach beef over rice
시금치프리타타,Spinach frittata
시금치된장무침,Spinach seasoned with soybean paste
시금치국,Spinach soup
시금치맑은국,Spinach soup(clear)
시금치된장국,Spinach soy paste soup
봄동된장나물,Spring cabbage in soy sauce
봄동된장국,Spring cabbage soy paste soup
잔파느타리버섯강회,Spring onion and oyster mushroom ties
실파콩나물국,Spring onion bean sprout soup
대파무채국,Green onion daikon soup
실파무채국,Spring onion daikon soup
실파달걀국,Spring onion egg  soup
실파미소장국,Spring onion miso paste soup
대파감자국,Spring onion potato soup
실파김국,Spring onion salted seaweed soup
실파맑은국,Spring onion soup
실파장국,Spring onion soy paste soup
대파된장찌개,Green onion soy paste stew
참나물토마토샐러드,Spring parsley and tomato salad
참나물된장국,Spring parsley soy paste soup
새싹채소샐러드,Sprout salad
양파오징어국,Squid onion soup
오징어감자국,Squid potato soup
가지찜,Steamed aubergine
가지양념찜,Steamed aubergine in sauce
양념가지찜,Steamed aubergine with marinade sauce
보리밥,Steamed barley rice
보리밥(30),Steamed barley rice (30)
보리밥(40),Steamed barley rice (40)
콩나물찜,Steamed bean sprout
소고기떡찜,Steamed beef with rice cake
흑미밥,Steamed black rice
흑미밥(30),Steamed black rice (30)
흑미밥(40),Steamed black rice (40)
현미밥,Steamed brown rice
현미밥(30),Steamed brown rice (30)
현미밥(40),Steamed brown rice (40)
현미찹쌀밥(30),Steamed brown sweet  rice (30)
현미찹쌀밥,Steamed brown sweet rice
현미찹쌀밥(40),Steamed brown sweet rice (40)
양배추찜,Steamed cabbage
양배추찜+쌈장,Steamed cabbage + soy red chilli paste
브로콜리양배추찜,Steamed cabbage with broccoli
양배추숙쌈+쌈장,Steamed cabbage wraps + soy red chilli paste
찐당근스틱,Steamed carrot stick
밤콩밥,Steamed chestnut bean rice
밤콩밥(30),Steamed chestnut bean rice (30)
밤콩밥(40),Steamed chestnut bean rice (40)
밤찹쌀팥밥,Steamed chestnut red bean sweet rice
밤찹쌀팥밥(30),Steamed chestnut red bean sweet rice (30)
밤찹쌀팥밥(40),Steamed chestnut red bean sweet rice (40)
밤밥,Steamed chestnut rice
밤밥(30),Steamed chestnut rice (30)
밤밥(40),Steamed chestnut rice (40)
닭찜,Steamed chicken with vegetables
찜닭,Steamed chicken
닭살콩나물찜,Steamed chicken and bean sprouts
고구마찜닭,Steamed chicken and sweet potato
단호박찜닭,Steamed chicken and sweet pumpkin
닭애호박찜,Steamed chicken and zucchini
닭다리살콩가루부추찜,Steamed chicken drumstick with chive and bean powder
닭다리카레찜,Steamed chicken drumsticks in curry
닭살카레찜,Steamed chicken in curry
간장찜닭,Steamed chicken in soy sauce
닭안심애호박찜,Steamed chicken tenderloin and zucchini
닭날개북어찜,Steamed chicken wings and pollack
콩가루부추찜,Steamed chive with bean powder
꼬막찜,Steamed cockle
대구양념찜,Steamed cod in marinade sauce
찐옥수수,Steamed corn
옥수수밥,Steamed corn rice
옥수수밥(30),Steamed corn rice (30)
옥수수밥(40),Steamed corn rice (40)
조기찜,Steamed corvina
오징어찜,Steamed cuttlefish
단호박오징어찜,Steamed cuttlefish and sweet pumpkin
북어채소찜,Steamed dried pollack veggie
찐달걀,Steamed eggs
달걀찜(30g),Steamed eggs (30g)
달걀찜(40g),Steamed eggs (40g)
아몬드달걀찜,Steamed eggs with almond
베이컨달걀찜,Steamed eggs with bacon
브로콜리달걀찜,Steamed eggs with broccoli
치즈달걀찜,Steamed eggs with cheese
옥수수달걀찜,Steamed eggs with corn
콘달걀찜,Steamed eggs with corn(canned)
매생이달걀찜,Steamed eggs with maesaengyi
달걀우유찜,Steamed eggs with milk
우유달걀찜,Steamed eggs with milk and vegetables
명란달걀찜,Steamed eggs with salted pollack roe
새우살달걀찜,Steamed eggs with shrimp
새우살채소달걀찜,Steamed eggs with shrimp and vegetables
맛살달걀찜,Steamed eggs with soft crab
시금치달걀찜,Steamed eggs with spinach
단호박달걀찜,Steamed eggs with sweet pumpkin
삼색채소달걀찜,Steamed eggs with three-color vegetables
채소달걀찜,Steamed eggs with vegetables
미나리달걀찜,Steamed eggs with winter celery
애호박생선살찜,Steamed fish and zucchini
순살가자미찜,Steamed halibut
가자미양념찜,Steamed halibut in marinade sauce
고등어찜,Steamed mackerel
찐만두,Steamed mandu (dumpling)
기장밥,Steamed millet rice
수수밥,Steamed Sorghum rice
기장밥(30),Steamed millet rice (30)
수수밥(30),Steamed Sorghum rice (30)
기장밥(40),Steamed millet rice (40)
수수밥(40),Steamed Sorghum rice (40)
잡곡밥,Steamed mixed-grain rice
잡곡밥(30),Steamed mixed-grain rice (30)
잡곡밥(40),Steamed mixed-grain rice (40)
완두콩밥,Steamed mung bean rice
완두콩밥(30),Steamed mung bean rice (30)
완두콩밥(40),Steamed mung bean rice (40)
낙지해물찜,Steamed octopus and seafood
낙지떡찜,Steamed octopus with rice cake
율무밥,Steamed pearl barley rice
율무밥(30),Steamed pearl barley rice (30)
율무밥(40),Steamed pearl barley rice (40)
깻잎찜,Steamed perilla leaf
깻잎멸치찜,Steamed perilla leaf and anchovy
동태찜,Steamed frozen pollack
북어찜,Steamed dried pollack
코다리찜,Steamed semi dried pollack
코다리양념찜,Steamed pollack in marinade sauce
돼지고기찜,Steamed pork
돼지고기콩나물찜,Steamed pork and bean sprout
돼지고기단호박찜,Steamed pork and sweet pumpkin
삼겹단호박찜,Steamed pork belly and sweet pumpkin
돼지갈비찜,Steamed pork rib
감자돼지갈비찜,Steamed pork rib and potato
돼지갈비고구마찜,Steamed pork rib and sweet potato
돼지고기사태찜,Steamed pork shank
단호박사태찜,Steamed pork shank and sweet pumpkin
돼지고기수육,Steamed pork slices
묵은지김치찜,Steamed pork with ripe kimchi
찐감자,Steamed potato
감자밥,Steamed potato rice
감자밥(30),Steamed potato rice (30)
감자밥(40),Steamed potato rice (40)
팥밥,Steamed red bean rice
팥밥(30),Steamed red bean rice (30)
팥밥(40),Steamed red bean rice (40)
찹쌀팥밥,Steamed sweet rice and red bean
팥찹쌀밥,Steamed red bean sweet rice
찹쌀팥밥(30),Steamed sweet rice and red bean (30)
팥찹쌀밥(30),Steamed red bean sweet rice (30)
찹쌀팥밥(40),Steamed sweet rice and red bean (40)
팥찹쌀밥(40),Steamed red bean sweet rice (40)
쌀밥,Steamed rice
쌀밥(30),Steamed rice (30)
콩나물밥,Steamed rice with bean sprout
콩나물밥+양념장,Steamed rice with bean sprout + marinade sauce
콩나물무밥,Steamed rice with bean sprout and daikon
콩나물무밥+양념장,Steamed rice with bean sprout and daikon + marinade sauce
검정콩밥,Steamed rice with black beans
검정콩밥(30),Steamed rice with black beans (30)
검정콩밥(40),Steamed rice with black beans (40)
짜장밥,Steamed rice with black soy
삼선짜장밥,Steamed rice with black soy seafood
두부짜장밥,Steamed rice with black soy tofu
양배추밥+양념장,Steamed rice with cabbage + marinade sauce
취나물밥+양념장,Steamed rice with chwinamul + marinade sauce
마파두부밥,Steamed rice with mapa tofu
표고버섯콩나물밥,Steamed rice with pyogo mushroom and bean sprout
미역국밥,Steamed rice with seaweed soup
곤드레나물밥+양념장,Steamed rice with thistle + marinade sauce
곤드레콩나물밥+양념장,Steamed rice with thistle and bean sprout + marinade sauce
곤드레무밥+양념장,Steamed rice with thistle and daikon + marinade sauce
해물찜,Steamed seafood
단호박해물찜,Steamed seafood and sweet pumpkin
간장해물찜,Steamed seafood in soy sauce
새우미더덕찜,Steamed shrimp and styela
삼치무찜,Steamed spanish mackerel and daikon
삼치양념찜,Steamed spanish mackerel in marinade sauce
찹쌀보리밥,Steamed sweet barley rice
찹쌀보리밥(30),Steamed sweet barley rice (30)
찹쌀보리밥(40),Steamed sweet barley rice (40)
찰현미밥,Steamed sweet brown rice
찹쌀현미밥,Steamed sweet rice and brown rice
찰현미밥(30),Steamed sweet brown rice (30)
찹쌀현미밥(30),Steamed sweet rice and brown rice (30)
찰현미밥(40),Steamed sweet brown rice (40)
찹쌀현미밥(40),Steamed sweet rice and brown rice (40)
차조밥,Steamed sweet millet rice
차조밥(30),Steamed sweet millet rice (30)
차조밥(40),Steamed sweet millet rice (40)
단배추시래기찜,Steamed sweet napa cabbage and dried radish leaves
찐고구마,Steamed sweet potato
고구마밥,Steamed sweet potato rice
고구마밥(30),Steamed sweet potato rice (30)
고구마밥(40),Steamed sweet potato rice (40)
고구마표고버섯밥,Steamed sweet potato rice with pyogo mushroom
단호박찜,Steamed sweet pumpkin
찐단호박,Boiled sweet pumpkin
훈제오리단호박찜,Steamed sweet pumpkin and roasted smoked duck
단호박우유찜,Steamed sweet pumpkin with milk
단호박견과류찜,Steamed sweet pumpkin with nuts
찹쌀밥,Steamed sweet rice
찹쌀밥(30),Steamed sweet rice (30)
찹쌀밥(추가),Steamed sweet rice (add)
두부찜,Steamed tofu
온두부찜,Boiled tofu
두부찜+흑임자소스,Steamed tofu + black sesame sauce
온두부+양념장,Steamed tofu + marinade sauce
두부찜+김치볶음,Steamed tofu + stir-fried kimchi
두부달걀찜,Steamed tofu and eggs
미나리장떡,Steamed winter celery with rice cake in red chilli paste
멸치볶음,Stir-fried anchovy
멸치아몬드볶음,Stir-fried anchovy and almond
멸치꽈리볶음,Stir-fried anchovy and chilli pepper
김부각멸치볶음,Stir-fried anchovy and deep-fried seaweed
편마늘멸치볶음,Stir-fried anchovy and garlic flakes
견과류멸치볶음,Stir-fried anchovy and nuts
멸치파프리카볶음,Stir-fried anchovy and paprika
멸치피망볶음,Stir-fried anchovy and sweet pepper
멸치땅콩볶음,Stir-fried anchovy and peanut
멸치새송이버섯볶음,Stir-fried anchovy and saesongyi mushroom
멸치호두볶음,Stir-fried anchovy and crashed walnut
호두멸치볶음,Stir-fried anchovy and walnut
깻잎순멸치볶음,Stir-fried anchovy with perilla leaves
돼지고기우엉두루치기,Stir-fried and braised pork and burdock
실치볶음,Stir-fried mini anchovy
잔멸치볶음,Stir-fried baby anchovy
아몬드잔멸치볶음,Stir-fried baby anchovy and almond
잔멸치아몬드볶음,Stir-fried baby anchovy and crashed almond
쪽파잔멸치볶음,Stir-fried baby anchovy and shallot
유자청잔멸치볶음,Stir-fried baby anchovy in yuzu marinade
베이컨브로콜리볶음,Stir-fried bacon and broccoli
베이컨숙주볶음,Stir-fried bacon and green bean sprout
베이컨파프리카볶음,Stir-fried bacon and paprika
베이컨감자볶음,Stir-fried bacon and potato
베이컨감자채볶음,Stir-fried bacon and shredded potato
고구마베이컨볶음,Stir-fried bacon and sweet potato
베이컨채소볶음,Stir-fried bacon and vegetables
베이컨팽이버섯볶음,Stir-fried bacon and winter mushroom
베이컨애호박볶음,Stir-fried bacon and zucchini
소고기당면불고기,Stir-fried barbequed beef and glass noodles
소고기버섯불고기,Stir-fried barbequed beef and mushroom
불고기떡볶음,Stir-fried barbequed beef and rice cake
콩나물잡채,Stir-fried bean sprout and glass noodles
소고기볶음,Stir-fried beef
소고기가지볶음,Stir-fried beef and aubergine
소고기청경채볶음,Stir-fried beef and bokchoy
소고기브로콜리볶음,Stir-fried beef and broccoli
소고기우엉볶음,Stir-fried beef and burdock
소고기양배추볶음,Stir-fried beef and cabbage
소고기당근볶음,Stir-fried beef and carrot
소고기오이볶음,Stir-fried beef and cucumber
소고기마늘종볶음,Stir-fried beef and garlic stalk
소고기당면볶음,Stir-fried beef and glass noodles
소고기숙주볶음,Stir-fried beef and green bean sprout
소고기굴소스숙주볶음,Stir-fried beef and green bean sprouts with oyster sauce
소고기파채볶음,Stir-fried beef and green onion shreds
소고기부추볶음,Stir-fried beef and korean-leeks
소고기버섯볶음,Stir-fried beef and mushroom
소고기양파볶음,Stir-fried beef and onions
소고기파프리카볶음,Stir-fried beef and paprika
소고기피망볶음,Stir-fried beef and sweet pepper
소고기깻잎볶음,Stir-fried beef and perilla leaves
소고기파인애플볶음,Stir-fried beef and pineapple
소고기감자볶음,Stir-fried beef and potato
소고기무볶음,Stir-fried beef and radish
소고기가래떡볶음,Stir-fried beef and long rice cake
소고기떡볶음,Stir-fried beef and rice cake
소고기표고버섯볶음,Stir-fried beef and shiitake mushroom
소고기단호박볶음,Stir-fried beef and sweet pumpkin
소고기토마토볶음,Stir-fried beef and tomato
소고기채소볶음,Stir-fried beef and vegetables
소고기양송이볶음,Stir-fried beef and yangsongyi mushroom
차돌볶음,Stir-fried beef brisket
차돌양배추볶음,Stir-fried beef brisket and cabbage
차돌숙주볶음,Stir-fried beef brisket and green bean sprout
소고기폭찹,Stir-fried beef chop
소고기채굴소스볶음,Stir-fried beef in oyster sauce
소고기안심버섯볶음,Stir-fried beef tenderloin and mushroom
소고기굴소스볶음,Stir-fried beef with oyster sauce
도라지볶음,Stir-fried bellflower root
청경채볶음,Stir-fried bokchoy
순살돼지고기김치볶음,Stir-fried boneless pork and kimchi
고사리들깨볶음,Stir-fried bracken with perilla seeds
브로콜리볶음,Stir-fried broccoli
브로콜리달걀볶음,Stir-fried broccoli and eggs
브로콜리마늘볶음,Stir-fried broccoli and garlic
브로콜리버섯볶음,Stir-fried broccoli and mushroom
브로콜리견과류볶음,Stir-fried broccoli and nuts
브로콜리새우볶음,Stir-fried broccoli and shrimp
브로콜리맛살볶음,Stir-fried broccoli and soft crab
브로콜리채소볶음,Stir-fried broccoli and vegetables
브로콜리버터볶음,Stir-fried broccoli with butter
우엉볶음,Stir-fried burdock
우엉소고기볶음,Stir-fried burdock and beef
우엉잡채,Stir-fried burdock and glass noodles
양배추볶음,Stir-fried cabbage
어묵당근볶음,Stir-fried carrot and fried fish paste
당근숙주굴소스볶음,Stir-fried carrot and green bean sprout in oyster sauce
당근양파볶음,Stir-fried carrot and onion
당근고구마볶음,Stir-fried carrot and sweet potato
닭갈비,Stir-fried chicken
닭채볶음,Stir-fried shredded chicken meat
닭살청경채볶음,Stir-fried chicken and bokchoy
닭살브로콜리볶음,Stir-fried chicken and broccoli
닭살양배추볶음,Stir-fried chicken and cabbage
오이닭살참깨볶음,Stir-fried chicken and cucumber with sesame
닭살숙주볶음,Stir-fried chicken and green bean sprout
닭살버섯볶음,Stir-fried chicken and mushroom
닭살파프리카볶음,Stir-fried chicken(meat only) and paprika
닭살피망볶음,Stir-fried chicken and sweet pepper
닭피망볶음,Stir-fried chicken and paprika
닭살표고버섯볶음,Stir-fried chicken and pyogo mushroom
닭살채소볶음,Stir-fried chicken and vegetables
닭가슴살가지볶음,Stir-fried chicken breast and aubergine
